{
  "$schema": "schema/capability-declarations-v0.2.schema.json",
  "capabilities": [
    {
      "closure_rules": [
        "owner-native shards remain byte-for-byte authoritative",
        "projection never copies textbook body prose",
        "no absent semantics are inferred"
      ],
      "identity_set_scope": "native_shard_records",
      "identity_set_sha256": "0c1a38cef3068a4953993c03e5ad158515989f6994e45e585c471ac0e5924c0d",
      "loss_gap_report": {
        "reason": "All claimed adapter semantics are exact projections or exact native-shard references.",
        "status": "closed"
      },
      "name": "structure_localization",
      "native_count": 5973,
      "projected_count": 5715,
      "schema_binding": null,
      "shard_refs": [
        {
          "bytes": 3951284,
          "path": "backend/units.jsonl",
          "path_base": "owner_package_root",
          "record_id_set_sha256": "247df5245afcadfbfb1c08b434c75a71a66ac0533624333cc86d87f0d5257a33",
          "records": 2280,
          "role": "owner_native_units",
          "sha256": "f3bb94c660780116a29e1089b27b10a60e18034c0ed0d6ce5452d8799a2a8945"
        },
        {
          "bytes": 3740661,
          "path": "backend/segments.jsonl",
          "path_base": "owner_package_root",
          "record_id_set_sha256": "fc82d7478ddb7fe1953479f85512af4e1460a3af2f42604b27e5cc139d79ee77",
          "records": 2250,
          "role": "owner_native_segments",
          "sha256": "648f35e19b6b42ada3e9b0019b3e482c212a847b5d720c4d663f6ccff23aac78"
        },
        {
          "bytes": 664996,
          "path": "backend/relations.jsonl",
          "path_base": "owner_package_root",
          "record_id_set_sha256": "18aab924712faccaf05947cc1ce77bbecb1473b579a0a4f452057666401e1f84",
          "records": 1443,
          "role": "owner_native_relations",
          "sha256": "ac1c2766a8f2179ab210bdbbc425f5ad3ac54f20357259bdddebee0af611d361"
        }
      ],
      "state": "materialized",
      "version": "0.1.0"
    },
    {
      "closure_rules": [
        "owner-native shards remain byte-for-byte authoritative",
        "projection never copies textbook body prose",
        "no absent semantics are inferred"
      ],
      "identity_set_scope": "native_shard_records",
      "identity_set_sha256": "33a24a01e37a78b6616c8cc17e5e027bcd8812ab32cb9261b1ce3e5aa5a4138a",
      "loss_gap_report": {
        "reason": "Thirty native term rows omit schema/schema_version and 104 current term heads omit terminology_status; exact shards remain available without silent repair.",
        "status": "declared_limitation"
      },
      "name": "terminology",
      "native_count": 1083,
      "projected_count": 0,
      "schema_binding": null,
      "shard_refs": [
        {
          "bytes": 169924,
          "path": "backend/concepts.jsonl",
          "path_base": "owner_package_root",
          "record_id_set_sha256": "ecc69a67293ff8b52d559e5593238e86793d0bb4fc7c4742de21f8620e6720cf",
          "records": 535,
          "role": "owner_native_concepts",
          "sha256": "3e55b0612310f5434e6a8e746814504b6b9e9e014dba243dbe8ec2df68614540"
        },
        {
          "bytes": 369736,
          "path": "backend/terms.jsonl",
          "path_base": "owner_package_root",
          "record_id_set_sha256": "89e5981ec791021c8716edf699c6920d61a34f670426c3cc131839114a3a85a2",
          "records": 548,
          "role": "owner_native_terms",
          "sha256": "7ed9ad84065ab452aa63f47dde5606ae0814943a4346ac5fe3499df8403ef50e"
        }
      ],
      "state": "referenced_native_shards",
      "version": "0.1.0"
    },
    {
      "closure_rules": [
        "owner-native shards remain byte-for-byte authoritative",
        "projection never copies textbook body prose",
        "no absent semantics are inferred"
      ],
      "identity_set_scope": "native_shard_records",
      "identity_set_sha256": "46ee7fda86eee93e15928f3548727496d597a4c2efdb8c27c19f0da8b7333280",
      "loss_gap_report": {
        "reason": "Specialized final validation passes, but the generic owner validator and one-command source-to-entire-backend replay are not closed.",
        "status": "declared_limitation"
      },
      "name": "mathematical_preservation",
      "native_count": 3046,
      "projected_count": 2390,
      "schema_binding": null,
      "shard_refs": [
        {
          "bytes": 3740661,
          "path": "backend/segments.jsonl",
          "path_base": "owner_package_root",
          "record_id_set_sha256": "fc82d7478ddb7fe1953479f85512af4e1460a3af2f42604b27e5cc139d79ee77",
          "records": 2250,
          "role": "owner_native_segments",
          "sha256": "648f35e19b6b42ada3e9b0019b3e482c212a847b5d720c4d663f6ccff23aac78"
        },
        {
          "bytes": 129064,
          "path": "backend/qa.jsonl",
          "path_base": "owner_package_root",
          "record_id_set_sha256": "0966536fad0289a8d40cc2199c8e2419a2495e06de8524a90c102dd9979ba5f3",
          "records": 230,
          "role": "owner_native_qa",
          "sha256": "f94f32bf2f652ea704c7abf72ea4df28a8aa3dea31a5f30078e5a074ab99e3c5"
        },
        {
          "bytes": 599471,
          "path": "backend/corrections.jsonl",
          "path_base": "owner_package_root",
          "record_id_set_sha256": "e8e64cb069e6aacd7ffaff911b91a8750f84802767d31f56630c184ed4b69d54",
          "records": 566,
          "role": "owner_native_corrections",
          "sha256": "ab6e1a70be761135dfbc3076968c01978894c10520b50ef604004bd1dcea2871"
        }
      ],
      "state": "referenced_native_shards",
      "version": "0.1.0"
    },
    {
      "closure_rules": [
        "owner-native shards remain byte-for-byte authoritative",
        "projection never copies textbook body prose",
        "no absent semantics are inferred"
      ],
      "identity_set_scope": "native_shard_records",
      "identity_set_sha256": "0c1a38cef3068a4953993c03e5ad158515989f6994e45e585c471ac0e5924c0d",
      "loss_gap_report": {
        "reason": "Assessment, hint, solution, proof, and laboratory semantics are exact native metadata but do not yet have a separate global assessment table contract.",
        "status": "declared_limitation"
      },
      "name": "assessment_support",
      "native_count": 5973,
      "projected_count": 0,
      "schema_binding": null,
      "shard_refs": [
        {
          "bytes": 3951284,
          "path": "backend/units.jsonl",
          "path_base": "owner_package_root",
          "record_id_set_sha256": "247df5245afcadfbfb1c08b434c75a71a66ac0533624333cc86d87f0d5257a33",
          "records": 2280,
          "role": "owner_native_units",
          "sha256": "f3bb94c660780116a29e1089b27b10a60e18034c0ed0d6ce5452d8799a2a8945"
        },
        {
          "bytes": 3740661,
          "path": "backend/segments.jsonl",
          "path_base": "owner_package_root",
          "record_id_set_sha256": "fc82d7478ddb7fe1953479f85512af4e1460a3af2f42604b27e5cc139d79ee77",
          "records": 2250,
          "role": "owner_native_segments",
          "sha256": "648f35e19b6b42ada3e9b0019b3e482c212a847b5d720c4d663f6ccff23aac78"
        },
        {
          "bytes": 664996,
          "path": "backend/relations.jsonl",
          "path_base": "owner_package_root",
          "record_id_set_sha256": "18aab924712faccaf05947cc1ce77bbecb1473b579a0a4f452057666401e1f84",
          "records": 1443,
          "role": "owner_native_relations",
          "sha256": "ac1c2766a8f2179ab210bdbbc425f5ad3ac54f20357259bdddebee0af611d361"
        }
      ],
      "state": "referenced_native_shards",
      "version": "0.1.0"
    },
    {
      "closure_rules": [
        "owner-native shards remain byte-for-byte authoritative",
        "projection never copies textbook body prose",
        "no absent semantics are inferred"
      ],
      "identity_set_scope": "native_shard_records",
      "identity_set_sha256": "dbf40448b0577be97640faa380164352888d9b21abbd6424433dbf3257a7269c",
      "loss_gap_report": {
        "reason": "One historical artifact path is missing and one proof-census artifact hash is stale; both remain explicitly reported.",
        "status": "declared_limitation"
      },
      "name": "assets",
      "native_count": 366,
      "projected_count": 258,
      "schema_binding": null,
      "shard_refs": [
        {
          "bytes": 64692,
          "path": "backend/assets.jsonl",
          "path_base": "owner_package_root",
          "record_id_set_sha256": "b75cb39e168b728476aa3b5198cf2930b54fef5b51dfe271147e1183f15ea0db",
          "records": 87,
          "role": "owner_native_assets",
          "sha256": "1df40f8f6ca4f2fbfbe8a7b924a68a153713a20a4eebe1d014d8fb04669945f7"
        },
        {
          "bytes": 233018,
          "path": "backend/artifacts.jsonl",
          "path_base": "owner_package_root",
          "record_id_set_sha256": "d9ff547e033ca1fcd618ec33ac6a27c2892aebe368a4e2c41ec382c3e1e4a756",
          "records": 279,
          "role": "owner_native_artifacts",
          "sha256": "448a222ca2e573b34951cc21ae16ca60db46f06da1f5fec4cc3684bcb1253c29"
        }
      ],
      "state": "referenced_native_shards",
      "version": "0.1.0"
    },
    {
      "closure_rules": [
        "owner-native shards remain byte-for-byte authoritative",
        "projection never copies textbook body prose",
        "no absent semantics are inferred"
      ],
      "identity_set_scope": "native_shard_records",
      "identity_set_sha256": "e3375ed24ff5a594cd5cf955a547c0e07f78d752d9aa66610e73f32a4745d715",
      "loss_gap_report": {
        "reason": "Semantic HTML is verified and primary; the 564-page PDF is untagged and per-unit accessibility state is not universally normalized.",
        "status": "declared_limitation"
      },
      "name": "accessibility",
      "native_count": 596,
      "projected_count": 2,
      "schema_binding": null,
      "shard_refs": [
        {
          "bytes": 64692,